{
  "name": "Lash Mapping Stickers — Pack of 200",
  "description": "Self-adhesive lash mapping stickers for marking lash length and placement during extensions. Save time and improve consistency across treatments.",
  "category": "Lash & Brow",
  "price": 5.99,
  "priceTBC": true,
  "image1": "https://images.pexels.com/photos/5128220/pexels-photo-5128220.jpeg?auto=compress&cs=tinysrgb&w=800",
  "image2": "https://images.pexels.com/photos/5128089/pexels-photo-5128089.jpeg?auto=compress&cs=tinysrgb&w=800",
  "hasVariants": false,
  "stockStatus": "In Stock",
  "featured": false,
  "sku": "LSH-MAP-024"
}
