{
  "name": "Stainless Steel Lash Tweezers — Straight & Curved Set",
  "description": "Professional-grade stainless steel lash tweezers set including straight isolation tweezers and curved volume tweezers. Precision-tipped for accurate lash placement.",
  "category": "Lash & Brow",
  "price": 18.99,
  "priceTBC": true,
  "image1": "/images/products/lash-tweezers.jpg",
  "image2": "https://images.pexels.com/photos/5128089/pexels-photo-5128089.jpeg?auto=compress&cs=tinysrgb&w=800",
  "hasVariants": false,
  "stockStatus": "In Stock",
  "featured": false,
  "sku": "LSH-TWZ-025"
}
