{
  "name": "Professional Lash Adhesive — 5ml",
  "description": "Long-lasting professional lash extension adhesive with rapid dry time and strong bond. Formaldehyde-free formula. Suitable for classic, volume, and mega volume application.",
  "category": "Lash & Brow",
  "price": 12.99,
  "priceTBC": true,
  "image1": "/images/products/lash-adhesive.jpg",
  "image2": "https://images.pexels.com/photos/5128220/pexels-photo-5128220.jpeg?auto=compress&cs=tinysrgb&w=800",
  "hasVariants": false,
  "stockStatus": "In Stock",
  "featured": false,
  "sku": "LSH-ADH-022"
}
