{
  "name": "Vinyl Gloves — Box of 100",
  "description": "Economical vinyl gloves, latex-free and powder-free. A great choice for professionals who need a comfortable, lightweight option for non-invasive procedures.",
  "category": "Gloves & PPE",
  "price": 6.99,
  "priceTBC": true,
  "image1": "https://images.pexels.com/photos/7856715/pexels-photo-7856715.jpeg?auto=compress&cs=tinysrgb&w=800",
  "image2": "https://images.pexels.com/photos/4021259/pexels-photo-4021259.jpeg?auto=compress&cs=tinysrgb&w=800",
  "hasVariants": true,
  "variantName": "Size",
  "variantOptions": [
    "S",
    "M",
    "L",
    "XL"
  ],
  "stockStatus": "In Stock",
  "featured": false,
  "sku": "PPE-VIN-003"
}
